{
  "$schema": "../../../schemas/version.v1.schema.json",
  "access": {
    "packingProofCapabilities": [],
    "packingProofPermissions": [
      "recordings.search",
      "recordings.download",
      "recordings.delivery"
    ],
    "systemAccess": [
      {
        "id": "network",
        "reason": "连接 QQ 官方接口与用户配置的 PackingProof 主机"
      },
      {
        "id": "filesystem.read",
        "reason": "读取 QQBot 本机配置、加密凭据和运行状态"
      },
      {
        "id": "filesystem.write",
        "reason": "保存本机配置、加密凭据、日志和待发送的临时录像"
      },
      {
        "id": "other",
        "reason": "用户启用开机自动启动时写入当前 Windows 用户的启动项"
      }
    ]
  },
  "compatibility": {
    "minPackingProofVersion": "0.0.86",
    "platforms": {
      "windows": [
        "x64"
      ]
    }
  },
  "downloads": {
    "gitee": {
      "provider": "gitee",
      "url": "https://gitee.com/PackingProof/PackingProof-QQBot/releases/download/v0.0.11/packingproof.qqbot-0.0.11.ppext"
    },
    "github": {
      "provider": "github",
      "url": "https://github.com/PackingProof/PackingProof-QQBot/releases/download/v0.0.11/packingproof.qqbot-0.0.11.ppext"
    }
  },
  "extensionId": "packingproof.qqbot",
  "publishedAt": "2026-10-31T02:11:55+08:00",
  "schemaVersion": 1,
  "sha256": "19056bdcf5be34bec827c49d2fcd7e3e980eab0155ecdd3a1723ac83917d59b1",
  "size": 587558,
  "source": {
    "commit": "f1268b287892a210981e1cd393c3fdc6f50df7e7",
    "tag": "v0.0.11"
  },
  "version": "0.0.11"
}
