{
  "$schema": "../../../schemas/version.v1.schema.json",
  "access": {
    "packingProofCapabilities": [],
    "packingProofPermissions": [],
    "systemAccess": []
  },
  "compatibility": {
    "minPackingProofVersion": "0.0.63",
    "platforms": {
      "userscript": [
        "any"
      ]
    }
  },
  "downloads": {
    "gitee": {
      "provider": "gitee",
      "url": "https://gitee.com/PackingProof/PackingProof-KDZS/releases/download/v2.17/packingproof.kdzs-2.17.ppext"
    },
    "github": {
      "provider": "github",
      "url": "https://github.com/PackingProof/PackingProof-KDZS/releases/download/v2.17/packingproof.kdzs-2.17.ppext"
    }
  },
  "extensionId": "packingproof.kdzs",
  "publishedAt": "2026-10-06T07:21:08Z",
  "schemaVersion": 1,
  "sha256": "882cea83021a4e987de3218c10c3bacc7a5d4662baf4c548e85f23e0c3cc5af5",
  "size": 31615,
  "source": {
    "commit": "3a2fe87db6e9320a3bc20a6fe2a8739e6d142e0b",
    "tag": "v2.17"
  },
  "version": "2.17"
}
