{
  "$schema": "../../../schemas/version.v1.schema.json",
  "access": {
    "packingProofCapabilities": [],
    "packingProofPermissions": [
      "recordings.search",
      "recordings.download",
      "recordings.delivery"
    ],
    "systemAccess": [
      {
        "id": "network",
        "reason": "连接 QQ 官方接口与用户配置的 PackingProof 主机"
      },
      {
        "id": "filesystem.read",
        "reason": "读取 QQBot 本机配置、加密凭据和运行状态"
      },
      {
        "id": "filesystem.write",
        "reason": "保存本机配置、加密凭据、日志和待发送的临时录像"
      },
      {
        "id": "other",
        "reason": "用户启用开机自动启动时写入当前 Windows 用户的启动项"
      }
    ]
  },
  "compatibility": {
    "minPackingProofVersion": "0.0.62",
    "platforms": {
      "windows": [
        "x64"
      ]
    }
  },
  "downloads": {
    "primary": {
      "provider": "github",
      "url": "https://github.com/PackingProof/PackingProof-QQBot/releases/download/v0.0.3/packingproof.qqbot-0.0.3.ppx"
    }
  },
  "extensionId": "packingproof.qqbot",
  "publishedAt": "2026-08-29T09:37:09Z",
  "schemaVersion": 1,
  "sha256": "302d23c9d786e15e0f4ddc3ae18022dacb48338103c4bcf81a5129f74d21a023",
  "size": 72514429,
  "source": {
    "commit": "d275b2bb232f8263d1e7a763909ed29cdb028be8",
    "tag": "v0.0.3"
  },
  "version": "0.0.3"
}
